conteudo,sentimento,tema,universidade,perfil
Cada disciplina tem uma relação diferente com IA. Não dá pra ter uma regra única pra tudo.,neutro,Regulamentação do Uso de IA em Provas e TCCs,USP,progressista-técnico
"Transição sim, mas com plano de proteção pra quem vai perder emprego nas indústrias tradicionais.",neutro,Transição Energética e Custo para a População,FGV,liberal-econômico
"Corte dói, mas o orçamento público é finito. Precisamos de priorização, não de carta branca.",negativo,Cortes no Orçamento das Universidades Federais,USP,progressista-técnico
Cada disciplina tem uma relação diferente com IA. Não dá pra ter uma regra única pra tudo.,neutro,Regulamentação do Uso de IA em Provas e TCCs,UFBA,progressista-nordestino
Depende muito de como a educação cívica for implementada junto. Não dá pra separar.,neutro,Voto Obrigatório vs. Facultativo aos 16 Anos,UFBA,progressista-nordestino
Difícil equilibrar proteção contra ódio e liberdade de expressão. Não existe solução perfeita.,neutro,Regulamentação das Redes Sociais e Discurso de Ódio,MACKENZIE,conservador-técnico
FIES tem problema de inadimplência estrutural. Precisa de reforma antes de expansão.,neutro,Expansão ou Corte do FIES e ProUni,UFMG,progressista-regional
"tá bom, há exceções que já são legais. Legalização ampla é diferente e eu discordo.",negativo,Descriminalização vs. Legalização do Aborto,UNB,político-crítico
Transição energética não pode jogar a conta no consumidor de baixa renda. Isso é injustiça disfarçada de ecologia.,negativo,Transição Energética e Custo para a População,UNICAMP,técnico-crítico
"cara, pesquisa científica exige processo cognitivo que IA não substitui. Sou contra o uso sem restrição.",negativo,Regulamentação do Uso de IA em Provas e TCCs,MACKENZIE,conservador-técnico
FIES tem problema de inadimplência estrutural. Precisa de reforma antes de expansão.,neutro,Expansão ou Corte do FIES e ProUni,FGV,liberal-econômico
"visse, reforma tributária bem feita simplifica e desoneração a produção. Não é criar novo imposto.",negativo,Reforma Tributária e Imposto sobre Grandes Fortunas,UFBA,progressista-nordestino
Prefiro debater educação política nas escolas antes de decidir sobre obrigatoriedade.,neutro,Voto Obrigatório vs. Facultativo aos 16 Anos,FGV,liberal-econômico
"O custo da transição precisa ser distribuído de forma progressiva. Não é simples, mas é necessário.",neutro,Transição Energética e Custo para a População,INSPER,liberal-meritocrático
"Voto aos 16 sim, mas a discussão sobre obrigatório vs. facultativo é legítima e não tem resposta óbvia.",neutro,Voto Obrigatório vs. Facultativo aos 16 Anos,UNB,político-crítico
Prefiro debater educação política nas escolas antes de decidir sobre obrigatoriedade.,neutro,Voto Obrigatório vs. Facultativo aos 16 Anos,INSPER,liberal-meritocrático
"Transição sim, mas com plano de proteção pra quem vai perder emprego nas indústrias tradicionais.",neutro,Transição Energética e Custo para a População,USP,progressista-técnico
FIES tem problema de inadimplência estrutural. Precisa de reforma antes de expansão.,neutro,Expansão ou Corte do FIES e ProUni,UNB,político-crítico
"IGF faz sentido em tese, mas a implementação no Brasil seria complexa demais sem reforma do judiciário junto.",neutro,Reforma Tributária e Imposto sobre Grandes Fortunas,MACKENZIE,conservador-técnico
"O debate precisa separar o aspecto jurídico, o de saúde pública e o ético. Estão misturados aqui.",neutro,Descriminalização vs. Legalização do Aborto,INSPER,liberal-meritocrático
"que absurdo, finalmente a universidade tratando saúde mental como pauta institucional séria.",positivo,Saúde Mental no Ambiente Universitário,PUC_SP,progressista-católico
"véi, quem define o que é discurso de ódio? O governo? Isso é perigoso demais.",negativo,Regulamentação das Redes Sociais e Discurso de Ódio,UFRJ,progressista-carioca
"Sô, crise climática não espera o momento politicamente conveniente. Precisamos agir agora.",positivo,Transição Energética e Custo para a População,INSPER,liberal-meritocrático
"Apoio a meta, mas o prazo e o modelo de financiamento precisam de debate técnico sério.",neutro,Transição Energética e Custo para a População,USP,progressista-técnico
"Apoio o acesso, mas o modelo precisa garantir que o diploma tenha valor no mercado depois.",neutro,Expansão ou Corte do FIES e ProUni,UNICAMP,técnico-crítico
Depende muito de como a educação cívica for implementada junto. Não dá pra separar.,neutro,Voto Obrigatório vs. Facultativo aos 16 Anos,UNICAMP,técnico-crítico
"Sou contra IGF. Quem tem patrimônio já paga IPTU, ITCMD, dividendos. Mais imposto não é solução.",negativo,Reforma Tributária e Imposto sobre Grandes Fortunas,FGV,liberal-econômico
Liberdade de expressão não é liberdade pra desumanizar. Apoio o PL das redes.,positivo,Regulamentação das Redes Sociais e Discurso de Ódio,UFMG,progressista-regional
"Regulamentação sim, mas o modelo importa. PL atual tem problemas sérios que precisam ser corrigidos.",neutro,Regulamentação das Redes Sociais e Discurso de Ódio,INSPER,liberal-meritocrático
"Apoio o acesso, mas o modelo precisa garantir que o diploma tenha valor no mercado depois.",neutro,Expansão ou Corte do FIES e ProUni,UFRJ,progressista-carioca
"ai meu deus, mais arma em circulação é mais risco pra todo mundo. Os dados de homicídio confirmam.",positivo,Desarmamento vs. Flexibilização do Porte de Armas,PUC_SP,progressista-católico
A academia que não incorpora novas ferramentas fica pra trás. Regulamentação inteligente é o caminho.,positivo,Regulamentação do Uso de IA em Provas e TCCs,USP,progressista-técnico
Apoio total à criação de serviços de apoio psicológico gratuito no campus. Era o mínimo.,positivo,Saúde Mental no Ambiente Universitário,PUC_SP,progressista-católico
"oxe, finalmente a universidade tratando saúde mental como pauta institucional séria.",positivo,Saúde Mental no Ambiente Universitário,UFBA,progressista-nordestino
Cada campus tem realidade diferente. Uma política nacional de saúde mental universitária precisa de flexibilidade.,neutro,Saúde Mental no Ambiente Universitário,MACKENZIE,conservador-técnico
"O corte é real e prejudica, mas a solução não é só mais recurso — é também mais eficiência.",neutro,Cortes no Orçamento das Universidades Federais,FGV,liberal-econômico
FIES tem problema de inadimplência estrutural. Precisa de reforma antes de expansão.,neutro,Expansão ou Corte do FIES e ProUni,UFRJ,progressista-carioca
O problema de saúde mental universitária tem raiz na precariedade do próprio sistema. Não resolve com palestra.,negativo,Saúde Mental no Ambiente Universitário,USP,progressista-técnico
FIES tem problema de inadimplência estrutural. Precisa de reforma antes de expansão.,neutro,Expansão ou Corte do FIES e ProUni,UFBA,progressista-nordestino
"Oxe, cortar FIES em ano de desemprego alto é a pior decisão possível.",positivo,Expansão ou Corte do FIES e ProUni,USP,progressista-técnico
Países que legalizaram viram queda no número de abortos e zero aumento. Os dados estão aí.,positivo,Descriminalização vs. Legalização do Aborto,UFBA,progressista-nordestino
O problema do Brasil não é pouca tributação de rico — é gasto público ineficiente. Começar por aí.,negativo,Reforma Tributária e Imposto sobre Grandes Fortunas,UFRJ,progressista-carioca
"Uso como ferramenta auxiliar tudo bem, mas precisamos definir o que é plágio nesse novo contexto.",neutro,Regulamentação do Uso de IA em Provas e TCCs,INSPER,liberal-meritocrático
"Apoio a iniciativa, mas quero ver dados de impacto antes de dizer que está funcionando.",neutro,Saúde Mental no Ambiente Universitário,INSPER,liberal-meritocrático
"Apoio a meta, mas o prazo e o modelo de financiamento precisam de debate técnico sério.",neutro,Transição Energética e Custo para a População,PUC_SP,progressista-católico
"Voto aos 16 sim, mas a discussão sobre obrigatório vs. facultativo é legítima e não tem resposta óbvia.",neutro,Voto Obrigatório vs. Facultativo aos 16 Anos,INSPER,liberal-meritocrático
"Oxe, cortaram bolsa de IC, verba de laboratório e agora querem cortar manutenção de campus. Até quando?",positivo,Cortes no Orçamento das Universidades Federais,PUC_SP,progressista-católico
"Manifestação unificada de reitores contra os cortes. Apoio total. Ciência não é gasto, é investimento.",positivo,Cortes no Orçamento das Universidades Federais,USP,progressista-técnico
"Sou a favor do suporte, mas sem enfrentar a raiz — competição, precariedade, futuro incerto — não muda nada.",negativo,Saúde Mental no Ambiente Universitário,INSPER,liberal-meritocrático
Prefiro debater educação política nas escolas antes de decidir sobre obrigatoriedade.,neutro,Voto Obrigatório vs. Facultativo aos 16 Anos,USP,progressista-técnico
Difícil equilibrar proteção contra ódio e liberdade de expressão. Não existe solução perfeita.,neutro,Regulamentação das Redes Sociais e Discurso de Ódio,UNB,político-crítico
"gente, criar um 'setor de bem-estar' sem mudar a cultura de pressão é enganação.",negativo,Saúde Mental no Ambiente Universitário,PUC_SP,progressista-católico
"Contra corte indiscriminado, mas a favor de auditoria e transparência no uso do orçamento universitário.",neutro,Cortes no Orçamento das Universidades Federais,MACKENZIE,conservador-técnico
"faz sentido, energia renovável ainda é cara e intermitente. Não dá pra desligar termelétrica do dia pra noite.",negativo,Transição Energética e Custo para a População,INSPER,liberal-meritocrático
"ué, pesquisa científica exige processo cognitivo que IA não substitui. Sou contra o uso sem restrição.",negativo,Regulamentação do Uso de IA em Provas e TCCs,UNICAMP,técnico-crítico
"cara, FIES e ProUni são as únicas portas de entrada no ensino superior pra quem não passou em federal.",positivo,Expansão ou Corte do FIES e ProUni,UNICAMP,técnico-crítico
"Sou a favor do suporte, mas sem enfrentar a raiz — competição, precariedade, futuro incerto — não muda nada.",negativo,Saúde Mental no Ambiente Universitário,UFBA,progressista-nordestino
"Apoio a iniciativa, mas quero ver dados de impacto antes de dizer que está funcionando.",neutro,Saúde Mental no Ambiente Universitário,UNB,político-crítico
"Uso como ferramenta auxiliar tudo bem, mas precisamos definir o que é plágio nesse novo contexto.",neutro,Regulamentação do Uso de IA em Provas e TCCs,USP,progressista-técnico
Voto obrigatório sem educação cívica séria é ritual vazio. Facultativo com consciência é melhor.,positivo,Voto Obrigatório vs. Facultativo aos 16 Anos,MACKENZIE,conservador-técnico
"olha, energia renovável ainda é cara e intermitente. Não dá pra desligar termelétrica do dia pra noite.",negativo,Transição Energética e Custo para a População,MACKENZIE,conservador-técnico
"basicamente, transição energética é inevitável. Quanto mais tarde, mais caro pra todo mundo.",positivo,Transição Energética e Custo para a População,INSPER,liberal-meritocrático
"basicamente, banir IA é ingenuidade. Precisamos ensinar a usar com ética e transparência.",positivo,Regulamentação do Uso de IA em Provas e TCCs,FGV,liberal-econômico
"Arma não protege, estatística mundial é clara. Restrição salva vidas.",positivo,Desarmamento vs. Flexibilização do Porte de Armas,UFRJ,progressista-carioca
Nem desarmamento total nem porte livre. Regulamentação séria com critério é o meio-termo razoável.,neutro,Desarmamento vs. Flexibilização do Porte de Armas,MACKENZIE,conservador-técnico
Regulamentação de conteúdo é censura com outro nome. Sou contra.,negativo,Regulamentação das Redes Sociais e Discurso de Ódio,UFMG,progressista-regional
"Nossa, que avanço ter esse debate de forma séria. A PUC precisava disso há anos.",positivo,Saúde Mental no Ambiente Universitário,INSPER,liberal-meritocrático
PL das fake news na versão atual concentra poder de moderação no Estado. Não pode.,negativo,Regulamentação das Redes Sociais e Discurso de Ódio,UNICAMP,técnico-crítico
"Oxe, cortar FIES em ano de desemprego alto é a pior decisão possível.",positivo,Expansão ou Corte do FIES e ProUni,MACKENZIE,conservador-técnico
Difícil equilibrar proteção contra ódio e liberdade de expressão. Não existe solução perfeita.,neutro,Regulamentação das Redes Sociais e Discurso de Ódio,UFBA,progressista-nordestino
"Nossa, que avanço ter esse debate de forma séria. A PUC precisava disso há anos.",positivo,Saúde Mental no Ambiente Universitário,MACKENZIE,conservador-técnico
Nem proibir nem liberar sem critério. Precisamos de política clara e consistente entre os departamentos.,neutro,Regulamentação do Uso de IA em Provas e TCCs,USP,progressista-técnico
Cada disciplina tem uma relação diferente com IA. Não dá pra ter uma regra única pra tudo.,neutro,Regulamentação do Uso de IA em Provas e TCCs,UFRJ,progressista-carioca
Cidadão de bem desarmado é vítima fácil. Sou a favor do porte responsável.,negativo,Desarmamento vs. Flexibilização do Porte de Armas,UFRJ,progressista-carioca
"tá na moral, muito formando que não consegue emprego na área e fica com dívida impagável. O modelo está errado.",negativo,Expansão ou Corte do FIES e ProUni,UFRJ,progressista-carioca
"Apoio descriminalização em casos extremos, mas legalização ampla ainda gera dúvidas pra mim.",neutro,Descriminalização vs. Legalização do Aborto,FGV,liberal-econômico
"Uso como ferramenta auxiliar tudo bem, mas precisamos definir o que é plágio nesse novo contexto.",neutro,Regulamentação do Uso de IA em Provas e TCCs,INSPER,liberal-meritocrático
"Transição sim, mas com plano de proteção pra quem vai perder emprego nas indústrias tradicionais.",neutro,Transição Energética e Custo para a População,UFMG,progressista-regional
"Expansão sim, mas com critério de qualidade das instituições conveniadas. Nem toda privada serve.",neutro,Expansão ou Corte do FIES e ProUni,UFMG,progressista-regional
"Suporte psicológico é necessário, mas não suficiente. O debate precisa ir além do atendimento individual.",neutro,Saúde Mental no Ambiente Universitário,UFRJ,progressista-carioca
"que negócio é esse, aborto ilegal não evita aborto — mata mulher pobre. Descriminalização é pauta de saúde pública.",positivo,Descriminalização vs. Legalização do Aborto,UNB,político-crítico
"Apoio o acesso, mas o modelo precisa garantir que o diploma tenha valor no mercado depois.",neutro,Expansão ou Corte do FIES e ProUni,UFBA,progressista-nordestino
"Apoio regulamentação, mas com revisão independente e sem controle governamental direto.",neutro,Regulamentação das Redes Sociais e Discurso de Ódio,MACKENZIE,conservador-técnico
"Não é pauta de saúde pública, é pauta ideológica. Existem alternativas que precisam ser debatidas antes.",negativo,Descriminalização vs. Legalização do Aborto,UFRJ,progressista-carioca
"nossa, universidade federal não pode depender de repasse que muda a cada governo. Precisamos de autonomia orçamentária garantida em lei.",positivo,Cortes no Orçamento das Universidades Federais,PUC_SP,progressista-católico
Já vi TCC gerado por IA aprovado com distinção. O sistema não tá conseguindo avaliar mais nada.,negativo,Regulamentação do Uso de IA em Provas e TCCs,UFMG,progressista-regional
É uma pauta que divide genuinamente por valores. Não consigo reduzir a certo ou errado.,neutro,Descriminalização vs. Legalização do Aborto,UFBA,progressista-nordestino
"O debate precisa separar posse em casa, porte em via pública e uso por CAC. São coisas diferentes.",neutro,Desarmamento vs. Flexibilização do Porte de Armas,UFMG,progressista-regional
"A reforma simplificou o consumo, mas deixou a renda intocada. Avanço parcial.",neutro,Reforma Tributária e Imposto sobre Grandes Fortunas,FGV,liberal-econômico
"ProUni funciona melhor que FIES, mas ambos precisam de avaliação séria de impacto antes de ampliar.",negativo,Expansão ou Corte do FIES e ProUni,UFMG,progressista-regional
Apoio total à criação de serviços de apoio psicológico gratuito no campus. Era o mínimo.,positivo,Saúde Mental no Ambiente Universitário,UFRJ,progressista-carioca
Financiar faculdade privada de baixa qualidade com dinheiro público não é inclusão — é desperdício.,negativo,Expansão ou Corte do FIES e ProUni,UFRJ,progressista-carioca
Usar IA no TCC com citação e reflexão crítica é diferente de copiar. Precisamos distinguir.,positivo,Regulamentação do Uso de IA em Provas e TCCs,UFRJ,progressista-carioca
Tornar facultativo é enfraquecer a democracia. Jovem sem voto é jovem sem representação.,negativo,Voto Obrigatório vs. Facultativo aos 16 Anos,PUC_SP,progressista-católico
"Antes de reclamar de corte, as universidades deveriam apresentar prestação de contas séria.",negativo,Cortes no Orçamento das Universidades Federais,USP,progressista-técnico
Regulamentação de conteúdo é censura com outro nome. Sou contra.,negativo,Regulamentação das Redes Sociais e Discurso de Ódio,UFMG,progressista-regional
"FIES virou rombo fiscal sem retorno claro. Precisamos de critério mais rigoroso, não de expansão.",negativo,Expansão ou Corte do FIES e ProUni,PUC_SP,progressista-católico
"oxe, voto facultativo aos 16 respeita a autonomia de quem ainda não se sente pronto pra decidir.",positivo,Voto Obrigatório vs. Facultativo aos 16 Anos,UNB,político-crítico
"visse, quem define o que é discurso de ódio? O governo? Isso é perigoso demais.",negativo,Regulamentação das Redes Sociais e Discurso de Ódio,UFBA,progressista-nordestino
"Proibir é impossível, mas liberar sem critério é colapsar a avaliação acadêmica.",negativo,Regulamentação do Uso de IA em Provas e TCCs,INSPER,liberal-meritocrático
"Apoio regulamentação, mas com revisão independente e sem controle governamental direto.",neutro,Regulamentação das Redes Sociais e Discurso de Ódio,PUC_SP,progressista-católico
"Regulamentação sim, mas o modelo importa. PL atual tem problemas sérios que precisam ser corrigidos.",neutro,Regulamentação das Redes Sociais e Discurso de Ódio,MACKENZIE,conservador-técnico
Sou contra. Vida começa na concepção e o Estado não pode legitimar seu fim.,negativo,Descriminalização vs. Legalização do Aborto,UFRJ,progressista-carioca
"Transição sim, mas com plano de proteção pra quem vai perder emprego nas indústrias tradicionais.",neutro,Transição Energética e Custo para a População,UFMG,progressista-regional
"IGF faz sentido em tese, mas a implementação no Brasil seria complexa demais sem reforma do judiciário junto.",neutro,Reforma Tributária e Imposto sobre Grandes Fortunas,UNB,político-crítico
"FIES virou rombo fiscal sem retorno claro. Precisamos de critério mais rigoroso, não de expansão.",negativo,Expansão ou Corte do FIES e ProUni,MACKENZIE,conservador-técnico
Países que legalizaram viram queda no número de abortos e zero aumento. Os dados estão aí.,positivo,Descriminalização vs. Legalização do Aborto,USP,progressista-técnico
Apoio total à criação de serviços de apoio psicológico gratuito no campus. Era o mínimo.,positivo,Saúde Mental no Ambiente Universitário,MACKENZIE,conservador-técnico
"ProUni funciona melhor que FIES, mas ambos precisam de avaliação séria de impacto antes de ampliar.",negativo,Expansão ou Corte do FIES e ProUni,INSPER,liberal-meritocrático
"IGF não é radicalismo, é prática comum em países desenvolvidos. Apoio.",positivo,Reforma Tributária e Imposto sobre Grandes Fortunas,UNICAMP,técnico-crítico
"O debate precisa separar posse em casa, porte em via pública e uso por CAC. São coisas diferentes.",neutro,Desarmamento vs. Flexibilização do Porte de Armas,PUC_SP,progressista-católico
"véi, finalmente a universidade tratando saúde mental como pauta institucional séria.",positivo,Saúde Mental no Ambiente Universitário,UFRJ,progressista-carioca
Nem proibir nem liberar sem critério. Precisamos de política clara e consistente entre os departamentos.,neutro,Regulamentação do Uso de IA em Provas e TCCs,UFBA,progressista-nordestino
Restrição ao porte é paternalismo. Cada um deveria ter direito de se defender.,negativo,Desarmamento vs. Flexibilização do Porte de Armas,UNICAMP,técnico-crítico
"Sou a favor da transição, mas o ritmo proposto é irreal e vai comprometer abastecimento.",negativo,Transição Energética e Custo para a População,UFMG,progressista-regional
Regulamentação de conteúdo é censura com outro nome. Sou contra.,negativo,Regulamentação das Redes Sociais e Discurso de Ódio,UNB,político-crítico
"bão demais, facultativo favorece quem já tem voz. Obrigatório democratiza de verdade.",negativo,Voto Obrigatório vs. Facultativo aos 16 Anos,UFMG,progressista-regional
"Uso como ferramenta auxiliar tudo bem, mas precisamos definir o que é plágio nesse novo contexto.",neutro,Regulamentação do Uso de IA em Provas e TCCs,UFRJ,progressista-carioca
"basicamente, FIES e ProUni são as únicas portas de entrada no ensino superior pra quem não passou em federal.",positivo,Expansão ou Corte do FIES e ProUni,MACKENZIE,conservador-técnico
Apoio o desarmamento. Revogação dos decretos de Bolsonaro foi acerto.,positivo,Desarmamento vs. Flexibilização do Porte de Armas,UNICAMP,técnico-crítico
Difícil tomar partido sem ver o orçamento detalhado. Onde exatamente está sendo cortado?,neutro,Cortes no Orçamento das Universidades Federais,UFRJ,progressista-carioca
"Oxe, cortaram bolsa de IC, verba de laboratório e agora querem cortar manutenção de campus. Até quando?",positivo,Cortes no Orçamento das Universidades Federais,UFRJ,progressista-carioca
"O custo da transição precisa ser distribuído de forma progressiva. Não é simples, mas é necessário.",neutro,Transição Energética e Custo para a População,UNB,político-crítico
"O custo da transição precisa ser distribuído de forma progressiva. Não é simples, mas é necessário.",neutro,Transição Energética e Custo para a População,UFMG,progressista-regional
Restrição ao porte é paternalismo. Cada um deveria ter direito de se defender.,negativo,Desarmamento vs. Flexibilização do Porte de Armas,MACKENZIE,conservador-técnico
STF tem que garantir o direito. O Estado não pode obrigar ninguém a gestar contra a vontade.,positivo,Descriminalização vs. Legalização do Aborto,MACKENZIE,conservador-técnico
Cada campus tem realidade diferente. Uma política nacional de saúde mental universitária precisa de flexibilidade.,neutro,Saúde Mental no Ambiente Universitário,PUC_SP,progressista-católico
"Autonomia sobre o próprio corpo não é pauta política, é direito humano fundamental.",positivo,Descriminalização vs. Legalização do Aborto,UFMG,progressista-regional
"O debate precisa separar posse em casa, porte em via pública e uso por CAC. São coisas diferentes.",neutro,Desarmamento vs. Flexibilização do Porte de Armas,MACKENZIE,conservador-técnico
"Sou a favor da transição, mas o ritmo proposto é irreal e vai comprometer abastecimento.",negativo,Transição Energética e Custo para a População,UFRJ,progressista-carioca
IA gera texto plausível mas vazio. Deixar usar em TCC é institucionalizar a superficialidade.,negativo,Regulamentação do Uso de IA em Provas e TCCs,UFBA,progressista-nordestino
"nossa, há exceções que já são legais. Legalização ampla é diferente e eu discordo.",negativo,Descriminalização vs. Legalização do Aborto,PUC_SP,progressista-católico
Países que legalizaram viram queda no número de abortos e zero aumento. Os dados estão aí.,positivo,Descriminalização vs. Legalização do Aborto,UFMG,progressista-regional
Apoio total à criação de serviços de apoio psicológico gratuito no campus. Era o mínimo.,positivo,Saúde Mental no Ambiente Universitário,USP,progressista-técnico
Cada campus tem realidade diferente. Uma política nacional de saúde mental universitária precisa de flexibilidade.,neutro,Saúde Mental no Ambiente Universitário,USP,progressista-técnico
É uma pauta que divide genuinamente por valores. Não consigo reduzir a certo ou errado.,neutro,Descriminalização vs. Legalização do Aborto,INSPER,liberal-meritocrático
"Antes de reclamar de corte, as universidades deveriam apresentar prestação de contas séria.",negativo,Cortes no Orçamento das Universidades Federais,UFRJ,progressista-carioca
"cara, bandido não obedece lei de desarmamento. Só o cidadão honesto fica indefeso.",negativo,Desarmamento vs. Flexibilização do Porte de Armas,UNB,político-crítico
"faz sentido, muito formando que não consegue emprego na área e fica com dívida impagável. O modelo está errado.",negativo,Expansão ou Corte do FIES e ProUni,INSPER,liberal-meritocrático
"Suporte psicológico é necessário, mas não suficiente. O debate precisa ir além do atendimento individual.",neutro,Saúde Mental no Ambiente Universitário,UFRJ,progressista-carioca
Apoio a expansão. Cortar é fechar a universidade pra quem mais precisa dela.,positivo,Expansão ou Corte do FIES e ProUni,FGV,liberal-econômico
Depende muito de como a educação cívica for implementada junto. Não dá pra separar.,neutro,Voto Obrigatório vs. Facultativo aos 16 Anos,MACKENZIE,conservador-técnico
Financiar faculdade privada de baixa qualidade com dinheiro público não é inclusão — é desperdício.,negativo,Expansão ou Corte do FIES e ProUni,FGV,liberal-econômico
